{
  "$schema": "https://json-schema.org/draft/2020-12/schema",
  "title": "Halted State",
  "description": "Structured halt record written to ${OUTPUT_DIR}/HALTED.md (frontmatter or JSON sidecar).",
  "type": "object",
  "required": ["halt_reason", "halted_at", "halt_phase", "recovery_hint"],
  "additionalProperties": false,
  "properties": {
    "halt_reason": { "enum": ["scope_violation", "roe_violation", "replan_exhausted", "supervisor_failure", "quality_critical", "user_abort"] },
    "halted_at": { "type": "string", "format": "date-time" },
    "halt_phase": { "type": "string", "minLength": 1 },
    "supervisor_verdict": {
      "description": "Inlined supervisor-verdict JSON when halt_reason is supervisor-driven; null for sentinel-driven halts.",
      "type": ["object", "null"]
    },
    "recovery_hint": { "type": "string", "minLength": 1 }
  }
}
